Nome,Cidade,Bairro,Telefone,Estado,Local
Maxi Massas - Cataguases,Cataguases,Vila Minalda,(32) 99160-6064,MG,"Av Nicolau Siervi, 942, Vila Minalda, Cataguases - MG, CEP 36772-430"
Maxi Massas - Americana,Americana,Morada do Sol,(19) 99245-6777,SP,"Rua Camilo Damiani, 335, Morada do Sol, Americana - SP, CEP 13470-250"
Maxi Massas - Araraquara,Araraquara,Jardim Santa Clara (Vila Xavier),,SP,"Avenida Nelson Mariottini, 147, Jardim Santa Clara (Vila Xavier), Araraquara - SP, CEP 14811-375"
Maxi Massas - Araras,Araras,Jardim Esplanada,(19) 99145-5898,SP,"Rua Humberto Rodrigues Júnior, 86 B — sobrado com campainha , Jardim Esplanada, Araras - SP, CEP 13609-448"
Maxi Massas - Assis,Assis,Vila Orestes,(18) 99667-6399,SP,"Rua Padre Gusmão, 1382, Vila Orestes, Assis - SP, CEP 19806-082"
Maxi Massas - Bauru,Bauru,Geisel,(14) 99879-1216,SP,"R. das Limeiras, 263 , Geisel, Bauru - SP, CEP 17033-090"
Maxi Massas - Guarujá,Guarujá,Vila Zilda ,(13) 97408-8382,SP,"Rua Nove, 94 — Casa 1, Vila Zilda , Guarujá - SP, CEP 11436-545"
Maxi Massas - Hortolândia,Hortolândia,Jardim Residencial Veccon Buriti ,(19) 98317-5804,SP,"Rua 10, 86, Jardim Residencial Veccon Buriti , Hortolândia - SP, CEP 13185-730"
Maxi Massas - Iracemápolis,Iracemápolis,Jardim pérola ,(19) 99914-2001,SP,"Oscar Teixeira da mata, 54, Jardim pérola , Iracemápolis - SP, CEP 13484-512"
Maxi Massas - Itápolis,Itápolis,Centro,(14) 99663-7977,SP,"Rua Joaquim Nabuco, 47, Centro, Itápolis - SP, CEP 14900-027"
Maxi Massas - Itatiba,Itatiba,Loteamento Santo Antônio,(11) 98239-6004,SP,"Rua Santo Antônio, 50, Loteamento Santo Antônio, Itatiba - SP, CEP 13253-400"
Maxi Massas - Jundiaí,Jundiaí,Centro,,SP,"Rua Prudente de Moraes, 1438, Centro, Jundiaí - SP, CEP 13201-004"
Maxi Massas - Limeira,Limeira,Jd parque avenida ,(19) 98370-7631,SP,"Rua Emílio Perino, 408, Jd parque avenida , Limeira - SP, CEP 13482-248"
Maxi Massas - Mauá,Mauá,Vila Bocaina,(11) 95584-0904,SP,"Rua Prudente de Moraes, 541, Vila Bocaina, Mauá - SP, CEP 09310-300"
Maxi Massas - Mogi das Cruzes,Mogi das Cruzes,Jardim Aeroporto III,(11) 94974-0469,SP,"Gen. Longo, 53, Jardim Aeroporto III, Mogi das Cruzes - SP, CEP 08761-450"
Maxi Massas - Nova Odessa,Nova Odessa,Jardim Capuava ,(19) 99398-3004,SP,"R. dos Ingás, 357, Jardim Capuava , Nova Odessa - SP, CEP 13382-522"
Maxi Massas - Osasco,Osasco,Rochdale,(11) 97384-8621,SP,"Rua Paraná, 80, Rochdale, Osasco - SP, CEP 06220-170"
Maxi Massas - Ribeirão Preto,Ribeirão Preto,Alto da Boa Vista,(16) 99290-3737,SP,"Avenida Caramuru, 10, Alto da Boa Vista, Ribeirão Preto - SP, CEP 14025-710"
Maxi Massas - Rio Claro,Rio Claro,Vila Operária,(19) 97127-2351,SP,"Rua Antônio Sapucaio da Cruz, 2364 — entre Av Visconde e Av 26., Vila Operária, Rio Claro - SP, CEP 13181-684"
Maxi Massas - Rio Grande,Rio Grande,a,,SP,"aaaaa, 11, a, Rio Grande - SP, CEP 99030-051"
Maxi Massas - Santana de Parnaíba,Santana de Parnaíba,Chácara do Solar III,(11) 99534-0116,SP,"Rua Cruzeiro do Sul nº, Torre 5 un. 34, 430, Chácara do Solar III, Santana de Parnaíba - SP, CEP 06528-070"
Maxi Massas - Santo André (Vila Homero Thon ),Santo André,Vila Homero Thon ,(11) 93281-0274,SP,"Rua Oscar Thon, 54. Apto 4, Vila Homero Thon , Santo André - SP, CEP 09111-130"
Maxi Massas - Santo André (Vila Suiça),Santo André,Vila Suiça,(11) 99209-4575,SP,"Rua Galiléia, 31, Vila Suiça, Santo André - SP, CEP 09132-060"
Maxi Massas - Santos,Santos,Marapé,,SP,"Avenida Senador Pinheiro Machado, 576, Marapé, Santos - SP, CEP 11075-000"
Maxi Massas - São José do Rio Preto,São José do Rio Preto,Conjunto habitacional costa do sol,(17) 99608-6091,SP,"R. Ed Bernardino Carareto, 336 , Conjunto habitacional costa do sol, São José do Rio Preto - SP, CEP 15043-280"
Maxi Massas - São Paulo (Campo Belo),São Paulo,Campo Belo,(11) 97734-6552,SP,"Rua Demóstenes, 1308, Campo Belo, São Paulo - SP, CEP 04614-010"
Maxi Massas - São Paulo (Guarapiranga),São Paulo,Guarapiranga,(11) 99386-8395,SP,"Av Guarapiranga, 2480, Guarapiranga, São Paulo - SP, CEP 04911-005"
Maxi Massas - São Paulo (Imirim),São Paulo,Imirim,(11) 99498-2000,SP,"Rua João Dias da Silva, 125 - Imirim - 02541-020, Imirim, São Paulo - SP, CEP 02541-020"
Maxi Massas - São Paulo (Jardim Ipe),São Paulo,Jardim Ipe,(11) 95195-8683,SP,"Rua Antonio Pompeu de Camargo, 30, Jardim Ipe, São Paulo - SP, CEP 05797-220"
Maxi Massas - São Paulo (Jardim Santa Maria),São Paulo,Jardim Santa Maria,(11) 99102-2839,SP,"Rua Uacuma, 470, Jardim Santa Maria, São Paulo - SP, CEP 03575-000"
Maxi Massas - São Paulo (Maranhão-Tatuapé),São Paulo,Maranhão-Tatuapé,(11) 98309-9408,SP,"R. Retiro, 145, 145  —  apto 213 B , Maranhão-Tatuapé, São Paulo - SP, CEP 03073-005"
Maxi Massas - São Paulo (Parque Planalto),São Paulo,Parque Planalto,,SP,"Avenida Chão de Estrelas, 210, Parque Planalto, São Paulo - SP, CEP 04841-200"
Maxi Massas - São Paulo (Vila Dr Eiras - São Miguel Paulista),São Paulo,Vila Dr Eiras - São Miguel Paulista,(11) 94176-4558,SP,"Rua Eva Périco Rachid, 39 , Vila Dr Eiras - São Miguel Paulista, São Paulo - SP, CEP 08010-180"
Maxi Massas - São Paulo (Vila Maria),São Paulo,Vila Maria,(11) 98684-9589,SP,"Rua Eli, 1081, Vila Maria, São Paulo - SP, CEP 02114-012"
Maxi Massas - São Paulo (Vila Santa Catarina),São Paulo,Vila Santa Catarina,(11) 99546-4476,SP,"Rua Coriolano Durand, 541, Vila Santa Catarina, São Paulo - SP, CEP 04375-050"
Maxi Massas - São Paulo (Vila Socorro),São Paulo,Vila Socorro,(11) 99401-1344,SP,"Rua Professor Heráclito de Magalhães Viotti, 45, Vila Socorro, São Paulo - SP, CEP 04761-030"
Maxi Massas - Ubatuba,Ubatuba,Silop,(19) 98891-8626,SP,"Rua Jango Teixeira, 117 — Ap 31, Silop, Ubatuba - SP, CEP 11690-620"
Maxi Massas - Barretos,Barretos,,(17) 99198-0714,,"Rua 20 63x65 n 01513, Barretos, CEP 14787-279"
Maxi Massas - Cajamar,Cajamar,,(11) 99871-5499,,"Rua das Flores do Guarujá, 79, Cajamar, CEP 07791-235"
Maxi Massas - Cotia,Cotia,,(11) 9916-5039,,"Via das Magnólias, 421, Cotia, CEP 06713-270"
Maxi Massas - Embu das Artes,Embu das Artes,,(11) 99702-9606,,"Rua dos Cajamanga, 55, Embu das Artes, CEP 06835-310"
Maxi Massas - Itapetininga,Itapetininga,,,,Itapetininga
Maxi Massas - Piratininga,Piratininga,,(14) 98135-3303,,Piratininga
Maxi Massas Jd. Marajoara,São Paulo,,(11) 97830-2562,,"Rua Geraldo de Mendonça Melo, 280 - Vila Isa - CEP 04689-165, São Paulo"
Maxi Massas Vila dos Remédios,São Paulo,,,,São Paulo
Maxi Massas Sorocaba Maria A Prado,Sorocaba,,(15) 98823-4180,,"Avenida Itavuvu 2151, Sorocaba"
Maxi Massas Sorocaba Vila Jardini,Sorocaba,,(11) 97824-5330,,"Rua Professor Mário Aurélio Dias, 20, Sorocaba, CEP 18043-070"
Maxi Massas - Suzano,Suzano,,(11) 91338-7564,,"Rua Benedito Pinto da Cunha, 180, Suzano, CEP 08664-105"
Maxi Massas - Uberlândia,Uberlândia,,(34) 99775-2139,,"Avenida Jose Rezende Costa, 503 - 38408-010, Uberlândia"